[{"runId":"issue-74","id":"5bcc5634-cab4-4d0c-8c00-867632a6b383","previousDigest":null,"generation":0,"kind":"started","payload":{"goalRef":"issue:74","owner":"samue","profile":"standard","boundary":"open-pr","writer":{"host":"skynet-sam01","pid":30008,"instance":"3eb51be7-b42e-429f-a619-94b2a907b974"},"budget":null,"authorityProtocol":"host-intent-v1"},"timestamp":"2026-10-28T13:55:46.403Z","version":1,"type":"run-event","digest":"0789507bc10d89480d167153d1ff9cbb889719ba4f5010d60d9d77ec9ebc4d8e"},{"runId":"issue-74","id":"0ac9c77e-138c-4a86-b410-19072e16aea7","previousDigest":"0789507bc10d89480d167153d1ff9cbb889719ba4f5010d60d9d77ec9ebc4d8e","generation":0,"kind":"contract-frozen","payload":{"contract":{"version":2,"goalRevision":"f91cec62334249f199654523573f9810281463d907f7c26ee81134ad6b19291d","ownerRole":"agentflow:requester","collaborationContractDigest":"5ae9d7cb63268b7929b03f5f6bef33bb0a1c7587516751361e5c40e98b3ef300","criteria":[{"id":"s3-planning-evidence-0","definitionDigest":"3803df5e1fbd2637803f3f2cd5cf4aed01dec4c3e59867c4a7a657ac1f22e85d","assertions":["S3 phase0 real planning artifacts,22-case map and required schema5 fixture retain frozen integrity"],"allowedOrigins":["collector-observed"]}]},"sourceRevision":"705c591cfb99630d5af0ade94e89ab6045848b6d5b36bf15e4a05567d5893f6e"},"timestamp":"2026-10-28T14:16:53.575Z","version":1,"type":"run-event","digest":"8b56a598b5d9a26c9c70fef752cb2e04dee4eb3031421d12c8bcb16edfb57279"},{"runId":"issue-74","id":"d68e93d3-1c11-4b77-bfd4-d9901e2dfbc2","previousDigest":"8b56a598b5d9a26c9c70fef752cb2e04dee4eb3031421d12c8bcb16edfb57279","generation":0,"kind":"candidate","payload":{"digest":"cb48ce419c7196a248b5e5dd066fc1830a25c1fa7fec1e6c08f8f7277563bf7d"},"timestamp":"2026-10-28T14:17:46.182Z","version":1,"type":"run-event","digest":"5d566e189ae2427940c40298242fa0a5828cde6627f87d356c0d9b88c536a73c"},{"runId":"issue-74","id":"b53bd941-9a76-44b7-b7bc-0af000bbc967","previousDigest":"5d566e189ae2427940c40298242fa0a5828cde6627f87d356c0d9b88c536a73c","generation":0,"kind":"observation","payload":{"observation":{"id":"68d7a379-6e4d-4b66-9cf7-b13e27c6c96a","invocationId":"68d7a379-6e4d-4b66-9cf7-b13e27c6c96a","criterionId":"s3-planning-evidence-0","producer":"agentflow:process-collector","origin":"collector-observed","isolation":"cooperative","candidateDigest":"cb48ce419c7196a248b5e5dd066fc1830a25c1fa7fec1e6c08f8f7277563bf7d","definitionDigest":"3803df5e1fbd2637803f3f2cd5cf4aed01dec4c3e59867c4a7a657ac1f22e85d","executionContextDigest":"733d2daeedc59383978fc14aad1410b6cf8d7c29f037bcb80b730d8af3f8234f","executionContext":{"platform":"win32","architecture":"x64","collectorRuntime":"v26.10.0","executablePathDigest":"d28bfb0897cf8112493cd75eba61eaa8179b8edd2d8258d556ddcba703984be5","canonicalPathDigest":"d28bfb0897cf8112493cd75eba61eaa8179b8edd2d8258d556ddcba703984be5","executableContentDigest":"cea6ac365f9bb9586dafd2084d996e092e7d3e7d07ab52d1f76bf53d1fca9bc4","version":1,"type":"execution-context","digest":"733d2daeedc59383978fc14aad1410b6cf8d7c29f037bcb80b730d8af3f8234f"},"outcome":"pass","assertions":[{"id":"S3 phase0 real planning artifacts,22-case map and required schema5 fixture retain frozen integrity","outcome":"pass"}],"startedAt":"2026-10-28T14:17:45.287Z","completedAt":"2026-10-28T14:17:45.604Z","errors":[],"exitCode":0,"signal":null,"timedOut":false,"spawnErrorCode":null,"stderrExcerpt":"","version":1,"type":"verification-observation","digest":"3dc811e3409dedd4fdd0ff69e4a5962de87eb1bf8ecbf3f07eb7aa61e5399de2"}},"timestamp":"2026-10-28T14:17:55.806Z","version":1,"type":"run-event","digest":"a4402da6208ae0d3d0d1394b1e2190042ac6193210fada039a2351fbf2fca041"},{"runId":"issue-74","id":"5efe576c-7b0f-42fa-9ec8-f4bd6a696621","previousDigest":"a4402da6208ae0d3d0d1394b1e2190042ac6193210fada039a2351fbf2fca041","generation":0,"kind":"contract-frozen","payload":{"contract":{"version":2,"goalRevision":"95ddacdd840f0b116544563f06cb760e24262693283ade4bac8c68ad054a96ad","ownerRole":"agentflow:requester","collaborationContractDigest":"599536394d4461c9448e796248b3e6de4fc5889bdff277f981d776f2e804e30b","criteria":[{"id":"s3-planning-evidence-0","definitionDigest":"f5a5698e986e76ad9c5890cba59039499a4737862f4cb1d71e46e728f1560237","assertions":["S3 phase0 real planning artifacts,23-case map and required schema5 fixture retain frozen integrity"],"allowedOrigins":["collector-observed"]}]},"sourceRevision":"5c0cabb1f43770e31e78b52a3fd0515c028dd7782353c54721745fcb5dd96c55"},"timestamp":"2026-10-28T14:25:51.181Z","version":1,"type":"run-event","digest":"33ed6c2e744c380c2be1b3619c32bd4a648abce01258ab6fb17548e454e24644"},{"runId":"issue-74","id":"20f7b5f0-16b0-4ed1-a29e-0ccc2f06f619","previousDigest":"33ed6c2e744c380c2be1b3619c32bd4a648abce01258ab6fb17548e454e24644","generation":0,"kind":"candidate","payload":{"digest":"b11d0f7b738d916c7f245c3ffd048836fb85f77e3e321c720cfd67423c9a247d"},"timestamp":"2026-10-28T14:26:26.358Z","version":1,"type":"run-event","digest":"8f72349c565d5e98f13f6baf0204549ce6e62d59ac4c1c92b62d3884ceb9058c"},{"runId":"issue-74","id":"73939f23-96f2-40ec-b368-ca6d4dd4e86b","previousDigest":"8f72349c565d5e98f13f6baf0204549ce6e62d59ac4c1c92b62d3884ceb9058c","generation":0,"kind":"observation","payload":{"observation":{"id":"06e2349d-7bca-4e78-8e2a-480bdc620dc0","invocationId":"06e2349d-7bca-4e78-8e2a-480bdc620dc0","criterionId":"s3-planning-evidence-0","producer":"agentflow:process-collector","origin":"collector-observed","isolation":"cooperative","candidateDigest":"b11d0f7b738d916c7f245c3ffd048836fb85f77e3e321c720cfd67423c9a247d","definitionDigest":"f5a5698e986e76ad9c5890cba59039499a4737862f4cb1d71e46e728f1560237","executionContextDigest":"733d2daeedc59383978fc14aad1410b6cf8d7c29f037bcb80b730d8af3f8234f","executionContext":{"platform":"win32","architecture":"x64","collectorRuntime":"v26.10.0","executablePathDigest":"d28bfb0897cf8112493cd75eba61eaa8179b8edd2d8258d556ddcba703984be5","canonicalPathDigest":"d28bfb0897cf8112493cd75eba61eaa8179b8edd2d8258d556ddcba703984be5","executableContentDigest":"cea6ac365f9bb9586dafd2084d996e092e7d3e7d07ab52d1f76bf53d1fca9bc4","version":1,"type":"execution-context","digest":"733d2daeedc59383978fc14aad1410b6cf8d7c29f037bcb80b730d8af3f8234f"},"outcome":"pass","assertions":[{"id":"S3 phase0 real planning artifacts,23-case map and required schema5 fixture retain frozen integrity","outcome":"pass"}],"startedAt":"2026-10-28T14:26:25.592Z","completedAt":"2026-10-28T14:26:25.833Z","errors":[],"exitCode":0,"signal":null,"timedOut":false,"spawnErrorCode":null,"stderrExcerpt":"","version":1,"type":"verification-observation","digest":"1c896be118b2b32472c6d9a0218e3de63c0061649fb060b5ca80ee3ca78a3a20"}},"timestamp":"2026-10-28T14:26:34.234Z","version":1,"type":"run-event","digest":"22a05a9584a29916585c5e353656f90874d9841fad20f216318fd6c879b9d19a"},{"runId":"issue-74","id":"b0fbac31-942d-4f38-a1cb-7b7d6a913d65","previousDigest":"22a05a9584a29916585c5e353656f90874d9841fad20f216318fd6c879b9d19a","generation":0,"kind":"advanced","payload":{"from":0,"to":1,"candidateDigest":"b11d0f7b738d916c7f245c3ffd048836fb85f77e3e321c720cfd67423c9a247d","acceptanceDigest":"1a54ee63e2a67982a8fede36f3ec2a7929b81273f03b3e8f9604ad02c1be67f2","planDigest":"4c6410eaf178784c0b495fbc5ddf30948bbece5fe33796c52ca7edda382a0ea5","intentRequest":{"gateClass":"adequacy-of-intent","runId":"issue-74","runRevision":"22a05a9584a29916585c5e353656f90874d9841fad20f216318fd6c879b9d19a","generation":0,"goalRef":"issue:74","goalRevision":"95ddacdd840f0b116544563f06cb760e24262693283ade4bac8c68ad054a96ad","contractSourceRevision":"5c0cabb1f43770e31e78b52a3fd0515c028dd7782353c54721745fcb5dd96c55","contractDigest":"fe55c365be468278e543a468b3768c557d7c078bf7aecf8b5850eb0461ac222a","planDigest":"4c6410eaf178784c0b495fbc5ddf30948bbece5fe33796c52ca7edda382a0ea5","profile":"standard","observerRuntimes":["agy","antigravity","chatgpt","claude","codex","cowork","grok","pi"],"scope":{"repository":"smota/meshloop","coordinationBranch":"agentflow-state","businessBoundary":"open-pr","destinations":["ready-pr"],"checks":[{"name":"intent-evidence-check","digest":"1c58948d0434e67af1d7f583b7a7643d855a465fce7a5b9ede521f461a2969d7"},{"name":"planning-evidence-1","digest":"7a8da9292beec34997e085b083435e5cba2677960f14d2d68a995d9dec715b8c"},{"name":"planning-evidence-2","digest":"00137bf103775e7eeb61c347322b733fefb8eccd5c2a8ea3e7f4a655d08191b8"},{"name":"planning-evidence-3","digest":"321d1ab28b72a6a84bbb46410d60a03cbe0b18da3ffb5efb647745173760e99a"},{"name":"s2-oracle-suite","digest":"c15d746deb377b30903333f9fb0575554d1b5e042ec1e992e7acd5101c1d218d"},{"name":"s3-planning-evidence-0","digest":"51175e3226a4cf38d7bcaeb4995154d6074629dad2f6ab972c3d5130e8db72e1"},{"name":"s3-planning-evidence-1","digest":"a1e4686b069b6a7a1632f2dcccc0eb86663f22773fd0a79fa8fcf93a117bf613"},{"name":"s3-planning-evidence-2","digest":"bb81bf6c7e68038086e7af1b789be3364f77c3efdae791013c2f2a9d8e10e766"},{"name":"s3-planning-evidence-3","digest":"8671eb13bcdfb96c8e02e6b11976cd7f5433bcdde9adc30942d79f4f164fa593"},{"name":"workspace-check","digest":"6917e60d63b0931c65a2a254da7c24dced8782efd949dddb24dc834b074ddac4"}],"expiry":{"effectGrant":"separate-typed-grant-required"},"budget":null,"assurance":"agent-observed-local-cooperative"},"version":1,"type":"intent-consent-request","digest":"19bd089679975cde81c571ed90a988a30cd64161232449c4c35251851a45d6de"},"intentConsent":{"requestDigest":"19bd089679975cde81c571ed90a988a30cd64161232449c4c35251851a45d6de","gateClass":"adequacy-of-intent","runId":"issue-74","decision":"agree","assurance":"agent-observed-local-cooperative","observerRuntime":"codex","sessionDigest":"7662e37b631955196594895fa4852979ecd14742a233b3eaaff072b19f77a149","turnDigest":"ac8abcc297da05d3b96c1d73e54f1ec39965c368a2e5e0a0770b40c9576f695f","evidenceDigest":"5d86e8c0fe4a2c3881ab1e817196cc1e74bee0a77769a1521507b83186e79885","decisionRef":"fe2ac36cd351512c749e40b1bd1a564e88cc95ba8dec026fcfbc60f87e4cd401","observedAt":"2026-10-28T14:27:07.282Z","exp